BookTitle,AuthorName,SellingPrice,ListingPrice,TypeofBook,PrintLength,PublicationDate,Rating,ReviewCount,Availability
The Art of Statistics: Learning from Data (Pelican Books),David Spiegelhalte,10.11,10.99,Paperback,448,2020-02-13,4.5,3615,In stock
"Data Scientist Coloring Book. A Funny, Unique, Snarky Adult Coloring Book For Stress Relief And Relaxation. Pop Art Cartoon: Novelty Gift Idea For ... Analyst For Graduation & Appreciation",Witty Jobs Juni,6.85,0.0,Paperback,72,2022-07-30,4.5,2,In stock
Storytelling with Data: A Data Visualization Guide for Business Professionals,Cole Nussbaumer Knaflic,23.49,32.95,Paperback,288,2015-11-20,4.6,4651,In stock
"Data Analytics for Absolute Beginners: A Deconstructed Guide to Data Literacy: (Introduction to Data, Data Visualization, Business Intelligence & ... Science, Python & Statistics for Beginners)",Oliver Theobald,11.79,0.0,Paperback,159,2019-07-21,4.3,464,In stock
"Becoming a Data Head: How to Think, Speak, and Understand Data Science, Statistics, and Machine Learning",Alex J. Gutman,23.09,33.0,Paperback,272,2021-06-24,4.6,310,In stock
How to Win the Premier League: The Inside Story of Football’s Data Revolution,Ian Graham,16.99,22.0,Hardcover,320,2024-08-15,0.0,0,"This title will be released on August 15, 2024.  Pre-order now."
Microsoft Power BI Data Analyst Certification Guide: A comprehensive guide to becoming a confident and certified Power BI professional,Orrin Edenfield,33.99,0.0,Paperback,398,2022-06-24,4.0,44,In stock
AI & Data Literacy: Empowering Citizens of Data Science,Bill Schmarz,22.99,0.0,Paperback,202,2023-08-09,4.6,33,In stock
Data Grab: The new Colonialism of Big Tech and how to fight back,Ulises A. Mejias,15.16,22.0,Hardcover,320,2024-02-08,4.7,8,In stock
Engineers′ Data Book,Clifford Matthews,16.25,0.0,Paperback,344,2012-01-27,4.6,176,In stock
The Boat Data Book 8th Edition: The Owners' and Professionals' Bible,Ian Nicolson,28.92,32.99,Paperback,240,2024-07-04,0.0,0,In stock
"Data Analytics, Data Visualization & Communicating Data: 3 books in 1: Learn the Processes of Data Analytics and Data Science, Create Engaging Data ... Present Data Effectively (All Things Data)",Elizabeth Clarke,27.99,0.0,Paperback,528,2022-11-10,4.3,47,In stock
Data Visualisation: A Handbook for Data Driven Design,Andy Kirk,44.25,47.99,Paperback,328,2019-08-20,4.4,192,In stock
Fundamentals of Data Engineering: Plan and Build Robust Data Systems,Joe Reis,41.44,63.99,Paperback,446,2022-07-05,4.7,449,In stock
Daphne Draws Data: A Storytelling with Data Adventure,Cole Nussbaumer Knaflic,15.63,16.99,Hardcover,32,2024-10-29,0.0,0,"This title will be released on October 29, 2024.  Pre-order now."
"Deciphering Data Architectures: Choosing Between a Modern Data Warehouse, Data Fabric, Data Lakehouse, and Data Mesh",James Serra,42.99,63.99,Paperback,275,2024-03-12,4.2,40,In stock
"Laplink PCmover Professional 11 - Moves your Applications, Files, and Settings from an Old PC to a New PC - Includes optional Super-Speed USB 3.0 Cable - 1 Use",Unknown,59.95,0.0,Unknown,0,1970-01-01,4.1,339,In stock
"Python for Data Analysis 3e: Data Wrangling with pandas, NumPy, and Jupyter",Wes McKinney,45.13,63.99,Paperback,550,2022-08-26,4.5,284,In stock
"Designing Data-Intensive Applications: The Big Ideas Behind Reliable, Scalable, and Maintainable Systems",Martin Kleppmann,0.0,0.0,Kindle Edition,0,2017-03-16,4.7,4660,Out of stock
Azure Data Factory Cookbook: A data engineer's guide to building and managing ETL and ELT pipelines with data integration,Dmitry Foshin,41.99,0.0,Paperback,532,2024-02-28,4.0,8,In stock
"Ace the Data Science Interview: 201 Real Interview Questions Asked By FAANG, Tech Startups, & Wall Street",Nick Sing,30.13,34.5,Paperback,301,2021-08-16,4.5,986,In stock
Data Governance Handbook: A practical approach to building trust in data,Wendy S. Batchelde,37.99,0.0,Paperback,394,2024-05-31,5.0,2,In stock
Data and Analytics Strategy for Business: Unlock Data Assets and Increase Innovation with a Results-Driven Data Strategy,Simon Asplen-Tayl,25.62,29.99,Paperback,328,2022-06-03,4.7,41,In stock
The little book of data: First steps to your data transformation,Lisa Allen,7.99,0.0,Paperback,45,2021-03-29,4.4,23,In stock
R for Data Analysis in easy steps,Mike McGra,11.45,12.99,Paperback,192,2023-05-31,4.5,12,In stock
"Fundamentals of Data Analytics: Learn Essential Skills, Embrace the Future, and Catapult Your Career in the Data-Driven World—A Comprehensive Guide to Data Literacy for Beginners",Russell Dawson,11.53,0.0,Paperback,166,2023-11-25,4.6,43,In stock
"Data Analysis in Microsoft Excel: Deliver Awesome Analytics in 3 Easy Steps Using VLOOKUPS, Pivot Tables, Charts And More",Alex Holloway,14.49,0.0,Paperback,224,2023-07-21,4.2,59,In stock
Data Management at Scale: Modern Data Architecture with Data Mesh and Data Fabric,Piethein Strenghol,42.54,59.99,Paperback,300,2023-04-30,4.4,29,In stock
"Visualize This: The FlowingData Guide to Design, Visualization, and Statistics",Nathan Ya,26.5,34.99,Paperback,384,2024-05-23,4.6,3,Only 3 left in stock.
Data Analytics & Visualization All-in-One For Dummies,Jack A. Hyman,26.05,37.99,Paperback,832,2024-04-01,4.0,1,In stock
Metalworker's Data Book: No. 42 (Workshop Practice),Harold Hall,0.0,0.0,Paperback,128,2009-03-19,4.6,289,Out of stock
"Fish Mouth Sewing Machine Needle Threader, 2024 Upgraded Automatic Needle Threader for Sewing Machine, Quick Sewing Machine Loop Sewing Machine Needle Threader Tool (10PCS)",Unknown,8.99,0.0,Unknown,0,1970-01-01,0.0,0,Usually dispatched within 2 to 3 days
The Kaggle Book: Data analysis and machine learning for competitive data science,Konrad Banachewicz,0.0,0.0,Kindle Edition,0,2022-04-22,4.4,133,Out of stock
The Data Model Resource Book: A Library of Universal Data Models for All Enterprises,Len Silverston,0.0,0.0,"1st Edition, Kindle Edition",0,2008-05-05,4.3,60,Out of stock
Data Mesh,Zhamak Dehghani,0.0,0.0,Kindle Edition,0,2022-03-08,4.5,284,Out of stock
Data Governance For Dummies (For Dummies (Computer/tech)),Jonathan Reichental,9.99,24.99,Paperback,288,2022-12-05,4.3,32,In stock
"Essential Math for Data Science: Take Control of Your Data with Fundamental Linear Algebra, Probability, and Statistics",Thomas Nield,38.06,52.99,Paperback,350,2022-06-10,4.6,252,Only 14 left in stock.
"DAMA-DMBOK: Data Management Body of Knowledge: 2nd Edition: Data Management Body of Knowledge: 2nd Edition, Revised",DAMA International,70.67,74.99,Paperback,588,2017-07-01,4.7,678,In stock
Azure Data Engineer Associate Certification Guide: Ace the DP-203 exam with advanced data engineering skills,Giacinto Palmieri,37.99,0.0,Paperback,548,2024-05-23,4.6,9,In stock
"Cribsheet: A Data-Driven Guide to Better, More Relaxed Parenting, from Birth to Preschool",Emily Oste,9.99,10.99,Paperback,352,2020-04-09,4.4,5828,In stock
"Agile Data Warehouse Design: Collaborative Dimensional Modeling, from Whiteboard to Star Schema",Lawrence C,19.98,0.0,Paperback,328,2011-11-24,4.6,213,Only 1 left in stock.
"Data: Principles To Practice - Volume 1 'Foundations': Essential Foundations: Key Concepts behind Data Architecture, Engineering and Analysis for Professionals",Alex Holloway,0.0,0.0,Kindle Edition,0,2024-07-03,4.7,10,Out of stock
Data Engineering with Python cookbook: Learn to build efficient data pipelines using the Modern Cloud Data Stack,Adithyan Ramanujakootam,24.99,0.0,Paperback,266,2023-10-03,5.0,4,In stock
Data Ethics: Practical Strategies for Implementing Ethical Information Management and Governance,Katherine O'Keefe,39.99,44.99,Paperback,392,2023-06-03,5.0,4,In stock
Driving Data Projects: A comprehensive guide,Dr. Christine Haskell,33.44,34.99,Paperback,364,2024-02-26,5.0,8,Only 7 left in stock.
Python Programming Bible: [3 in 1] The Complete Crash Course to Learn and Explore Python beyond the Basics. Including Examples and Practical Exercises to Master Python from Beginners to Pro,James P. Meyers,18.97,0.0,Paperback,340,2023-10-13,4.3,104,In stock
"SQL Data Analytics Made Easy: Your Step-by-Step Guide to Unlocking Data’s Hidden Secrets: Demystify complex concepts, and harness the power of data to drive intelligent decision-making effortlessly.",L.D. Knowings,11.71,0.0,Paperback,210,2023-11-03,4.4,24,In stock
Cracking the Data: From the Sidelines to the Screens,Dr Erkut Sog,15.99,0.0,Paperback,112,2024-05-23,3.9,3,In stock
Covid By Numbers: Making Sense of the Pandemic with Data (Pelican Books),David Spiegelhalte,4.0,10.99,Hardcover,320,2021-10-07,4.5,175,In stock
Building a Data Driven Culture: A Step by Step Guide,Gethyn Ellis,11.99,0.0,Paperback,251,2023-10-06,4.9,23,In stock
Statistical Issues (v. 2) (A Handbook for Data Analysis in the Behavioral Sciences),"G. Keren 
(Edi",73.4,0.0,Hardcover,552,1993-01-01,0.0,0,Out of stock
"Bad Data: How Governments, Politicians and the Rest of Us Get Misled by Numbers",Georgina Sturge,0.0,0.0,Kindle Edition,0,2022-11-03,4.4,63,Out of stock
Data Science (The MIT Press Essential Knowledge series),John D. Kellehe,0.0,0.0,Kindle Edition,0,2018-04-13,4.5,537,Out of stock
Data Modeling with Snowflake: A practical guide to accelerating Snowflake development using universal data modeling techniques,Serge Gershkovic,37.99,0.0,Paperback,324,2023-05-31,4.8,34,In stock
Good Data: An Optimist's Guide to Our Digital Future,Sam Gilbe,0.0,0.0,Kindle Edition,0,2021-04-01,4.2,60,Out of stock
Prompt Engineering for Generative AI: Future-Proof Inputs for Reliable AI Outputs,James Phoenix,57.61,63.99,Paperback,422,2024-06-25,4.4,11,In stock
Predicting Solubility of New Drugs: Handbook of Critically Curated Data for Pharmaceutical Research,Alex Avdeef,0.0,0.0,[Print Replica] Kindle Edition,0,2024-05-27,0.0,0,Out of stock
Data Visualization with Excel Dashboards and Reports,Dick Kusleika,23.55,33.0,Paperback,352,2021-01-29,4.4,122,Only 6 left in stock (more on the way).
Data-driven Retailing: A Non-technical Practitioners' Guide (Management for Professionals),Louis-Philippe Kerkhove,36.85,44.99,Paperback,272,2023-10-07,0.0,0,In stock
ZEUS PRECISION DATA CHARTS AND REFERENCE,Unknown,9.69,0.0,Unknown Binding,0,1970-01-01,4.7,3,In stock
Data Storytelling in Marketing: How to Tell Persuasive Stories Through Data,Caroline Florence,30.15,31.99,Paperback,296,2024-06-03,0.0,0,In stock
Taxi Driver Client Data Log Book: A Logbook for Taxicab Drivers to Keep Track of Customer Information | Taxi Service Customer Record | 100 Pages,Hpso.Bv Publishing,6.42,0.0,Paperback,100,2024-04-24,0.0,0,In stock
"2024 New 2-in-1 Nasal Hair Cutter, Nostril Hair Remover Tool, Double Sided Nose Hair Knife, Portable Manual 360° Rotating Nose Hair Trimmer with Ear Picker for Women Men (5 Colors, 5PCS)",Unknown,16.99,0.0,Unknown,0,1970-01-01,0.0,0,In stock
Is it pronounced data or data?: 11 ways to improve data strategy in your organisation.,Mr Daniele Forni,8.99,0.0,Paperback,103,2023-05-29,5.0,4,In stock
Data Feminism (Strong Ideas),Catherine D'Ignazi,18.65,26.0,Paperback,328,2023-10-03,4.8,228,Only 10 left in stock (more on the way).
How Data Happened: A History from the Age of Reason to the Age of Algorithms,Chris Wiggins,14.99,0.0,Paperback,384,2024-04-30,4.1,52,In stock
"The Enterprise Data Catalog: Improve Data Discovery, Ensure Data Governance, and Enable Innovation",Ole Olesen-Bagneux,38.06,52.99,Paperback,216,2023-03-21,4.4,34,Only 3 left in stock.
Sniper Data Book: Rifle Shooting Log for the Tactical Marksman | Track & Improve Your Precision!,Planda Press,5.99,0.0,Paperback,109,2021-10-07,4.5,42,In stock
"50 Days of Data Analysis with Python: The Ultimate Challenges Book for Beginners: Hands-on Challenges with pandas, NumPy, Matplotlib, Sklearn and Seaborn",Benjamin Alexande,0.0,0.0,Kindle Edition,0,2023-12-03,4.2,4,Out of stock
Effective Pandas 2: Opinionated Patterns for Data Manipulation (Treading on Python Book 4),Matt Harrison,0.0,0.0,Kindle Edition,0,2024-03-14,4.4,21,Out of stock
Data Science For Dummies (For Dummies (Computer/Tech)),Lillian Pierson,20.25,28.99,Paperback,432,2021-09-01,4.5,75,In stock
A Little Guide for Teachers: Using Student Data,Richard Selfridge,10.99,0.0,Paperback,88,2024-06-26,0.0,0,In stock
Data Protection Act 2018: Full Printed Statute,Westminster Legal Publishing,9.99,0.0,Paperback,352,2018-05-23,4.8,8,In stock
Data Engineering with AWS: Acquire the skills to design and build AWS-based data transformation pipelines like a pro,Gareth Eaga,38.99,0.0,Paperback,636,2023-10-31,4.4,14,In stock
Data Center for Beginners: A beginner's guide towards understanding Data Center Design: 1 (Data Center Design Guide),B.A. Ayomaya,8.89,0.0,Paperback,60,2020-03-31,4.0,141,In stock
"Data Analytics for Process Engineers: Prediction, Control and Optimization (Synthesis Lectures on Mechanical Engineering)",Daniela Gala,34.29,0.0,Hardcover,154,2023-12-03,0.0,0,Only 2 left in stock (more on the way).
DATA SCIENCE AND PYTHON SCIKIT FOR BEGINNERS: UNLOCKING THE SECRETS OF DATA SCIENCE: STEP-BY-STEP INSTRUCTIONS FOR ASPIRING DATA SCIENTISTS - 2 BOOKS IN 1,JP PARKER,0.0,0.0,Kindle Edition,0,2024-07-09,0.0,0,Out of stock
People and Data: Uniting to Transform Your Business,Thomas C. Redman,24.99,29.99,Paperback,264,2023-07-03,4.7,15,In stock
Data Governance Success: Growing and Sustaining Data Governance,Rupa Mahanti,44.99,0.0,Paperback,247,2022-12-15,0.0,0,In stock
"Trust.: Responsible AI, Innovation, Privacy and Data Leadership",Dominique Shelton  Leipzig,0.0,0.0,Kindle Edition,0,2023-12-26,4.6,52,Out of stock
Python for Data Science For Dummies (For Dummies (Computer/tech)),John Paul Muelle,19.15,26.99,Paperback,464,2023-11-06,4.7,4,In stock
King Charles III England Coast Path Planner and Data Book: The South West Coast (Includes the entire South West Coast Path),Christine Saul,0.0,0.0,[Print Replica] Kindle Edition,0,2024-06-06,0.0,0,Out of stock
"Data Engineering with dbt: A practical guide to building a cloud-based, pragmatic, and dependable data platform with SQL",Roberto Zagni,37.99,0.0,Paperback,578,2023-06-30,4.6,7,In stock
AI & The Data Revolution: How Teams can Harness Disruption to Conquer Turmoil,Laura Madsen,34.99,39.99,Paperback,209,2024-07-01,5.0,3,In stock
The Unified Star Schema: An Agile and Resilient Approach to Data Warehouse and Analytics Design,Bill Inmon,44.05,44.99,Paperback,294,2020-10-12,4.3,60,In stock
"Excel: Comprehensive Resource with Formulas, Functions, Examples, Secrets, Illustrations, Practical Tips, and Versatile Templates for All Users",Taylor Gran,4.87,0.0,Paperback,207,2024-07-07,5.0,17,In stock
Fundamentals of Data Observability: Implement Trustworthy End-To-End Data Solutions,Andy Petrella,38.06,52.99,Paperback,264,2023-09-19,4.0,3,Only 3 left in stock.
Text as Data: A New Framework for Machine Learning and the Social Sciences,Justin Grimme,29.63,38.0,Paperback,360,2022-03-29,4.4,38,Only 2 left in stock (more on the way).
"Data-Driven Sales: Learn how B2B sales leaders at HubSpot, Salesloft, and other top companies use data to grow faster",Clearbi,14.38,0.0,Paperback,148,2018-04-25,3.9,14,In stock
Analysing Data For Your PhD: An Introduction (PhD Guides Book 3),Helen Kara,0.0,0.0,Kindle Edition,0,2023-02-21,0.0,0,Out of stock
Creating a Data–Driven Organization: Practical Advice from the Trenches,Carl Anderson,24.69,31.99,Paperback,302,2015-08-04,4.3,127,In stock
50 Page Accident/Injury Report Book A4 Complies with Data Protection Act 1998,Unknown,7.85,8.34,Unknown,0,1970-01-01,5.0,2,Only 14 left in stock.
Pat Testing Log Book: Record More than 2000 Entries| Large Print UK Edition| Electrical Appliances Safety Certificate | Portable Appliance Testing ... | Equipment for PAT Tester | 100 Pages,Data Pro Publishing,5.99,0.0,Paperback,106,2021-05-19,4.6,68,In stock
Excel Data Analysis For Dummies (For Dummies (Computer/Tech)),Paul McFedries,23.35,32.99,Paperback,368,2022-02-03,4.1,38,Only 14 left in stock (more on the way).
"How to Use Customer Data: Navigating GDPR, DPDI and a Future with Marketing AI",Sachiko Scheuing,34.97,0.0,Paperback,296,2024-06-03,5.0,1,In stock
Drawing Data with Kids: Cultivating Data-Literacy: A Screen-Free Journey through the Art of Visualization for Kids,Gulrez Khan,13.99,15.67,Paperback,126,2023-07-07,4.5,30,Only 4 left in stock (more on the way).
"SQL Made Easy: The Ultimate Guide For Beginners on Data Querying, Manipulation and Analysis using Real-World Context to Advance Your Career in Data Analytics",Alex Wade,14.99,0.0,Paperback,180,2024-03-13,4.9,18,In stock
Data Pipelines Pocket Reference: Moving and Processing Data for Analytics,James Densmore,12.76,23.99,Paperback,200,2021-03-31,4.5,346,In stock
Data Cartels: The Companies That Control and Monopolize Our Information,Sarah Lamdan,18.85,21.99,Paperback,224,2022-11-08,4.0,16,Only 1 left in stock (more on the way).
Analysing data,Helen Kara,0.0,0.0,Kindle Edition,0,2013-11-20,4.8,5,Out of stock
Data Literacy for Kids,"Kathleen Yu 
(Author, Illustra",12.46,0.0,Paperback,71,2023-07-22,5.0,4,In stock
Azure Data Factory Cookbook: Build and manage ETL and ELT pipelines with Microsoft Azure's serverless data integration service,Dmitry Anoshin,37.99,0.0,Paperback,382,2021-01-11,4.0,41,In stock
General Data Protection Regulation (GDPR) (Laws & Treaties Book 2),European  Commission,0.0,0.0,Kindle Edition,0,2023-07-29,0.0,0,Out of stock
The Afterlife of Data: What Happens to Your Information When You Die and Why You Should Care,Carl Öhman,0.0,0.0,Kindle Edition,0,2024-05-22,4.0,1,Out of stock
Data Center Design from Beginner to Professional,B.A. Ayomaya,24.69,0.0,Paperback,383,2021-04-14,3.9,14,In stock
"A Common–Sense Guide to Data Structures and Algorithms, 2e: Level Up Your Core Programming Skills",Jan Wengrow,23.44,36.99,Paperback,250,2020-06-30,4.8,733,In stock
Functional Aesthetics for Data Visualization,Vidya Setl,22.29,30.99,Paperback,336,2022-08-08,4.4,12,Only 7 left in stock (more on the way).
Getting Started with Data Science: Making Sense of Data with Analytics (IBM Press),Murtaza Haide,0.0,0.0,"1st Edition, Kindle Edition",0,2015-12-14,4.5,114,Out of stock
Mastering the Data Paradox: Key to Winning in the AI Age,Nitin Se,18.12,27.99,Hardcover,400,2024-04-01,4.8,324,Only 8 left in stock.
Resiliência Cibernética: Domine Estratégias de Segurança e Inteligências Artificiais Generativas (Portuguese Edition),Alessandro Carvalho Coutin,0.0,0.0,Kindle Edition,0,2024-07-09,5.0,6,Out of stock
Data Is Everybody's Business: The Fundamentals of Data Monetization (Management on the Cutting Edge),Barbara H. Wixom,0.0,0.0,Kindle Edition,0,2023-09-26,4.3,31,Out of stock
Data Discovery: How data is used and analyzed in business (D.A.T.A. Series Book 1),Todd Kelsey,0.0,0.0,Kindle Edition,0,2023-04-08,5.0,1,Out of stock
"SSIS Data Warehouse Development - 101 Interview Questions: Earn over £50,000 per annum using SSIS and SQL Server (The Data Engineering Series)",Jack Reynolds,0.0,0.0,Kindle Edition,0,2019-03-27,4.0,6,Out of stock
"AI IN BUSINESS: Leveraging Generative Artificial Intelligence to Drive Innovation, Improve Customer Experience & Gain a Competitive Advantage for Industry Leaders",James Robe,0.0,0.0,Kindle Edition,0,2024-07-02,4.7,34,Out of stock
The Data Mindset Playbook: A book about data for people who don't want to read about data,Gam Dias,16.99,0.0,Paperback,221,2022-10-22,5.0,15,In stock
All Data Are Local: Thinking Critically in a Data-Driven Society,Yanni Alexander Loukissas,0.0,0.0,Kindle Edition,0,2019-04-30,4.8,21,Out of stock
Data Strategy: From definition to execution,Ian Wallis,26.27,29.99,Paperback,316,2021-08-23,4.0,16,In stock
Data Points: Visualization That Means Something,Nathan Ya,0.0,0.0,"1st Edition, Kindle Edition",0,2013-03-25,4.4,150,Out of stock
"Building Data Science Applications with FastAPI: Develop, manage, and deploy efficient machine learning applications with Python, 2nd Edition",François Voron,0.0,0.0,Kindle Edition,0,2023-07-31,5.0,4,Out of stock
"Desvendando o Big Data: Tecnologias, Ferramentas e Aplicações Práticas (Portuguese Edition)",Wagner Souza,0.0,0.0,Kindle Edition,0,2024-07-07,0.0,0,Out of stock
Dark Data: Why What You Don’t Know Matters,David J. Hand,0.0,0.0,"Illustrated Edition, Kindle Edition",0,2020-02-18,4.2,50,Out of stock
Dive Into Data Science: Use Python To Tackle Your Toughest Business Challenges,Bradford Tuckfield,0.0,0.0,Kindle Edition,0,2023-07-04,4.4,10,Out of stock
R Programming: 3 books in 1 : R Basics for Beginners + R Data Analysis and Statistics + R Data Visualization,Andy Vickle,0.0,0.0,Kindle Edition,0,2022-04-27,3.8,5,Out of stock
"Practical SQL, 2nd Edition: A Beginner's Guide to Storytelling with Data",Anthony DeBarros,0.0,0.0,Kindle Edition,0,2022-01-25,4.7,177,Out of stock
MCRP 3-31B Amphibious Ships and Landing Craft Data Book,Luc Boudreaux,0.0,0.0,Kindle Edition,0,2023-05-03,0.0,0,Out of stock
Python Data Cleaning Cookbook: Modern techniques and Python tools to detect and remove dirty data and extract key insights,Michael Walke,0.0,0.0,Kindle Edition,0,2020-12-11,4.6,50,Out of stock
Metric Handbook: Planning and Design Data,"Pamela Buxton 
(Edi",0.0,0.0,[Print Replica] Kindle Edition,0,2021-11-25,4.5,39,Out of stock
Metalworker's Data Book for Home Machinists: The Essential Reference Guide for Everyone Who Works with Metal,Harold Hall,0.0,0.0,Paperback,200,2017-10-03,4.4,98,Out of stock
SQL Fundamentals for Beginners - Learn the Language of Databases,Aare Adegboyega,0.0,0.0,Kindle Edition,0,2024-07-10,0.0,0,Out of stock
"Data Augmentation with Python: Enhance deep learning accuracy with data augmentation methods for image, text, audio, and tabular data",Duc Haba,0.0,0.0,Kindle Edition,0,2023-04-28,5.0,3,Out of stock
Data Modeling with Microsoft Power BI,Markus Ehrenmueller-Jensen,0.0,0.0,Kindle Edition,0,2024-06-10,0.0,0,Out of stock
Data Engineering with AWS: Learn how to design and build cloud-based data transformation pipelines using AWS,Gareth Eaga,0.0,0.0,Kindle Edition,0,2021-12-29,4.3,89,Out of stock
Data Structures & Algorithms in Python (Developer's Library),John Canning,41.44,51.99,Paperback,928,2022-10-18,4.9,30,Only 12 left in stock (more on the way).
Data Science for Business: What You Need to Know about Data Mining and Data-Analytic Thinking,Foster Provos,27.09,39.99,Paperback,413,2013-09-17,4.5,1234,In stock
Data Breaches: Case Studies of Corporate Catastrophes,Dr Joe Reddington,9.99,0.0,Hardcover,152,2024-07-16,0.0,0,In stock
Business Intelligence Guidebook: From Data Integration to Analytics,Rick Sherman,0.0,0.0,"1st Edition, Kindle Edition",0,2014-11-04,4.4,100,Out of stock
The Chief Data Officer Management Handbook: Set Up and Run an Organization’s Data Supply Chain,Martin Trede,31.85,39.99,Paperback,454,2020-09-19,4.3,34,In stock
"Pacific Crest Trail Data Book: Mileages, Landmarks, Facilities, Resupply Data, and Essential Trail Information for the Entire Pacific Crest Trail, from Mexico to Canada",Benedict G,9.11,9.99,Paperback,128,2020-12-24,4.5,525,Only 14 left in stock.
Doing Data Science: Straight Talk from the Frontline,Cathy O'Neil,0.0,0.0,"1st Edition, Kindle Edition",0,2013-10-09,4.4,207,Out of stock
"Data Structures and Algorithm Analysis in C++, Third Edition (Dover Books on Computer Science)",Dr. Clifford A. Shaffe,0.0,0.0,"Third Edition, Kindle Edition",0,2011-09-14,4.5,44,Out of stock
M Is for (Data) Monkey: A Guide to the M Language in Excel Power Query,Ken Puls,0.0,0.0,Kindle Edition,0,2015-06-01,4.5,687,Out of stock
The Data Storyteller's Handbook: How to create business impact using data storytelling,Kat Greenbrook,0.0,0.0,[Print Replica] Kindle Edition,0,2023-12-04,4.8,28,Out of stock
Data Stewardship: An Actionable Guide to Effective Data Management and Data Governance,David Plotkin,39.91,45.95,Paperback,322,2020-11-10,4.7,67,Only 4 left in stock.
Navigating Sustainability Data: How Organizations can use ESG Data to Secure Their Future,Sherry Madera,29.99,34.99,Paperback,304,2024-01-03,0.0,0,In stock
Winning with Data Science: A Handbook for Business Leaders,Howard Steven Friedman,18.57,22.0,Hardcover,272,2024-01-30,5.0,3,In stock
Story of Art Sticker Book (Information Sticker Books),Sarah Courtauld,4.71,0.0,Paperback,52,2012-05-01,4.4,4,Out of stock
Doctoring Data: How to sort out medical advice from medical nonsense,Malcolm Kendrick,0.0,0.0,Kindle Edition,0,2015-02-07,4.7,696,Out of stock
Liquid Cooling For Data Centers,Charles Nehme,20.25,0.0,Paperback,30,2023-01-20,2.5,2,In stock
"Python, Javascript, Java, SQL, Linux: The Complete Coding and Developing Crash Course for Beginners (2024) (Computer Programming)",Mark Reed,0.0,0.0,Kindle Edition,0,2024-06-13,4.8,48,Out of stock
Weapons of Math Destruction: How Big Data Increases Inequality and Threatens Democracy,Cathy O'Neil,0.0,0.0,Kindle Edition,0,2016-09-06,4.4,4652,Out of stock
DataStory: Explain Data and Inspire Action Through Story,Nancy Duarte,19.59,24.99,Paperback,240,2019-10-03,4.5,620,In stock
The Data Strategy Handbook: Build your Data Strategy with this handbook and start your data journey for your organisation,Mr Stewart Buse,8.99,0.0,Paperback,59,2023-01-08,4.6,3,In stock
Master Your Data with Excel and Power BI: Leveraging Power Query to Get & Transform Your Task Flow,Ken Puls Miguel Escoba,22.25,27.99,Paperback,256,2021-11-01,4.6,172,Only 4 left in stock.
"SQL in 10 Minutes a Day, Sams Teach Yourself",Ben Forta,18.13,22.99,Paperback,256,2020-08-18,4.7,508,In stock
"The Ultimate Guide to Automating Your Data: Tables, Inbox, Reports, Analytics, and More (The Ultimate Guide to Jotform)",Aytekin Tank,10.22,0.0,Paperback,150,2024-05-28,0.0,0,In stock
"Show me the Data: Note Book for Data Collection- Gifts for ABA Therapist, Data Analysts, Statisticians, BCBA, Scientists, Mathematicians 120 page College ruled Journal 6"" x 9""",Data Nerd Gifts,5.55,0.0,Paperback,120,2019-06-17,4.8,8,In stock
